{
  "schemaVersion": 1,
  "model": "serializable",
  "initial": {
    "[\"mtw_provenance_dislock_20805b11ad0d.renew_success\",\"text\",\"cronjob-lock:lease:importer\"]": "55540ff8-794d-4a7d-bccb-61a7bba60127",
    "[\"mtw_provenance_dislock_20805b11ad0d.renew_success\",\"text\",\"cronjob-lock:lease:synchronizer\"]": "2f6e6e74-856f-40a2-b15f-16537fefa958"
  },
  "versionOrders": {},
  "transactions": [
    {
      "id": "tx-1",
      "status": "committed",
      "ops": [
        {
          "type": "read",
          "key": "[\"mtw_provenance_dislock_20805b11ad0d.renew_success\",\"text\",\"cronjob-lock:lease:importer\"]",
          "version": "55540ff8-794d-4a7d-bccb-61a7bba60127"
        },
        {
          "type": "read",
          "key": "[\"mtw_provenance_dislock_20805b11ad0d.renew_success\",\"text\",\"cronjob-lock:lease:importer\"]",
          "version": "55540ff8-794d-4a7d-bccb-61a7bba60127"
        },
        {
          "type": "write",
          "key": "[\"mtw_provenance_dislock_20805b11ad0d.renew_success\",\"text\",\"cronjob-lock:lease:importer\"]",
          "version": "38c34d0b-aec9-4f10-b390-8b101e37f164"
        },
        {
          "type": "read",
          "key": "[\"mtw_provenance_dislock_20805b11ad0d.renew_success\",\"text\",\"cronjob-lock:lease:importer\"]",
          "version": "38c34d0b-aec9-4f10-b390-8b101e37f164"
        },
        {
          "type": "read",
          "key": "[\"mtw_provenance_dislock_20805b11ad0d.renew_success\",\"text\",\"cronjob-lock:lease:importer\"]",
          "version": "38c34d0b-aec9-4f10-b390-8b101e37f164"
        },
        {
          "type": "write",
          "key": "[\"mtw_provenance_dislock_20805b11ad0d.renew_success\",\"text\",\"cronjob-lock:lease:importer\"]",
          "version": "0bf1e9a2-6e93-4e67-9c4f-7e1567ddb591"
        },
        {
          "type": "read",
          "key": "[\"mtw_provenance_dislock_20805b11ad0d.renew_success\",\"text\",\"cronjob-lock:lease:importer\"]",
          "version": "0bf1e9a2-6e93-4e67-9c4f-7e1567ddb591"
        }
      ],
      "start": 328000,
      "end": 375000
    }
  ]
}
