{
  "schemaVersion": 1,
  "model": "serializable",
  "initial": {
    "[\"mtw_provenance_dislock_615507a09425.rc_wait_source\",\"text\",\"cronjob-lock:lease:importer\"]": "e6fe727f-82df-47bf-a9d5-4a71eb38ec27",
    "[\"mtw_provenance_dislock_615507a09425.rc_wait_source\",\"text\",\"cronjob-lock:lease:synchronizer\"]": "cd247b31-7d2f-4172-9400-2403b6c48f06"
  },
  "versionOrders": {},
  "transactions": [
    {
      "id": "tx-1",
      "status": "committed",
      "ops": [
        {
          "type": "read",
          "key": "[\"mtw_provenance_dislock_615507a09425.rc_wait_source\",\"text\",\"cronjob-lock:lease:importer\"]",
          "version": "e6fe727f-82df-47bf-a9d5-4a71eb38ec27"
        }
      ],
      "start": 406000,
      "end": 406000
    },
    {
      "id": "tx-2",
      "status": "committed",
      "ops": [
        {
          "type": "read",
          "key": "[\"mtw_provenance_dislock_615507a09425.rc_wait_source\",\"text\",\"cronjob-lock:lease:importer\"]",
          "version": "e6fe727f-82df-47bf-a9d5-4a71eb38ec27"
        },
        {
          "type": "write",
          "key": "[\"mtw_provenance_dislock_615507a09425.rc_wait_source\",\"text\",\"cronjob-lock:lease:importer\"]",
          "version": "bbdef536-7579-41c7-b161-ae65895c7710"
        }
      ],
      "start": 406000,
      "end": 453000
    },
    {
      "id": "tx-3",
      "status": "committed",
      "ops": [
        {
          "type": "read",
          "key": "[\"mtw_provenance_dislock_615507a09425.rc_wait_source\",\"text\",\"cronjob-lock:lease:importer\"]",
          "version": "bbdef536-7579-41c7-b161-ae65895c7710"
        },
        {
          "type": "write",
          "key": "[\"mtw_provenance_dislock_615507a09425.rc_wait_source\",\"text\",\"cronjob-lock:lease:importer\"]",
          "version": "bab6aa30-f69e-4c77-95ac-5a94fb4edbaf"
        }
      ],
      "start": 437000,
      "end": 468000
    }
  ]
}
